cit,who,role,where,eng
"Un giornalista che mi incontra mi chiede ma lei e' fascista ma lei e' estremista, gli ho detto rivendico con orgoglio di essere fascista, se fascista vuole dire essere contro l'egemonia culturale della sinistra. Ho detto che rivendico di essere fascista se fascista vuol dire cacciare a pedate gli irregolari e i clandestini",Daniela Santanchè,Ministro del turismo,,
"Ritengo che non e' un problema. Cioe' noi ci stiamo occupando di un non problema. Perche' a me non impressiona, io sul comodino di casa mia, mi hanno regalato una bellissima testa del duce in legno e tutto, ce l'ho la tengo, non me ne vergogno, ma non e' che con questo inneggio al fascismo.",Daniela Santanchè,Ministro del turismo,,
"“O Parmigiano, portami via”,",Giorgia Meloni,Presidente del Consiglio,,
"Noi siamo una nazione che lo scorso anno ha fatto scappare 100000 italiani all'esterno e ha diciamo portato in italia in tre anni 500000 immigrati richiedenti asilo, si penso che ci sia un disegno di sostituzione etnica ",Giorgia Meloni,Presidente del Consiglio,,
Io sono una femminista. Le femministe non hanno mai considerato l'aborto un diritto,Eugenia Roccella,"Ministro della famiglia, natalità e pari opportunità","tv, In Onda, La7",I'm a feminist. Feminists never considered abortion as a right.
"Penso al provvedimento sulle unioni civili che, va detto con chiarezza, di fatto apre alla stepchild adoption. Per la sinistra, leggi come questa portano verso il progresso; per noi, vanno verso la fine dell’umano",Eugenia Roccella,"Ministro della famiglia, natalità e pari opportunità",https://espresso.repubblica.it/video/2018/01/29/video/centrodestra_unito_per_abolire_le_unioni_civili_vanno_verso_la_fine_dell_umano-321951741/,